ticket_id,org_id,date,transcript,issue_type,priority,is_repeating_issue,was_issue_resolved,resolution_time,sentiment
TICK_1,ORG_1,15/08/2023,"Agent: Good morning, Innovate Solutions Tech, how can I help?  Rep: We're seeing a delay in processing a wire transfer sent yesterday.  Reference number WT789456.  Agent: Let me check that for you. ... Okay, I see it's pending due to a secondary verification hold. It should be released within 2 hours. Rep: Please expedite; it's for critical vendor payment.",Payment Processing Issue,High,False,True,3 hours,-0.3
TICK_2,ORG_1,02/11/2023,"Rep: I'm calling to inquire about the status of our loan application submitted last week.  Agent:  Let me pull up your application... It's currently under review by the credit committee. We expect a decision by end of business tomorrow. Rep: Okay, thank you. Please keep us updated.",Loan Application,Medium,False,True,1 day,0.2
TICK_3,ORG_1,18/01/2024,"Rep: I am having issues accessing the online banking portal. I keep getting an error message saying, 'Invalid Credentials,' even though I'm sure I'm using the correct password. Agent: I can reset your password for you.  Please verify your account details... Okay, your password has been reset.  You'll receive an email with a temporary password.",Technical Support,Medium,False,True,15 minutes,0.1
TICK_4,ORG_1,22/02/2024,"Rep: We noticed an unusual transaction on our account statement – a debit of $50,000 that we don't recognize. Transaction ID is ABC123XYZ. Agent: Let me investigate. ... That transaction is flagged for potential fraud. We've temporarily blocked your card.  We'll need to verify some recent activity. Rep: Please expedite the resolution.",Fraud Alert,Critical,False,False,Not resolved,-0.8
TICK_5,ORG_1,10/03/2024,"Rep: We'd like to request an increase in our daily wire transfer limit. We have a large payment due to a new software vendor next month. Agent: I can assist with that. What limit are you requesting? Rep: We need it raised to $250,000. Agent: Okay, I'll submit the request. It requires approval, which usually takes 24-48 hours.",Service Request,Medium,False,True,2 days,0.4
TICK_6,ORG_1,25/04/2024,"Rep: I'm calling to get clarification on the interest rate applied to our current line of credit. The statement seems higher than expected. Agent: Let me pull up your account details...  The rate is variable and tied to the prime rate, which increased last month. You were notified via email.",Account Inquiry,Low,False,True,1 hour,-0.2
TICK_7,ORG_1,12/05/2024,"Rep: We have a series of international wire transfers to schedule, primarily to vendors in Europe. Can you advise on the best way to manage currency exchange and minimize fees? Agent: Yes, we offer foreign exchange services with competitive rates. I can connect you to a specialist to discuss hedging options.",Foreign Exchange Inquiry,Medium,False,True,1 day,0.6
TICK_8,ORG_1,03/06/2024,Rep: Our CFO needs access to the online banking platform with view-only privileges. Can you set that up? Agent: Certainly. Please provide their full name and email address. I'll create a new user profile with limited access.,User Account Management,Low,False,True,2 hours,0.3
TICK_9,ORG_1,19/06/2024,Rep: We're receiving duplicate statements in the mail. We only need one copy. Agent: I apologize for the inconvenience. I've updated your statement delivery preferences to receive only one copy.,Statement Delivery,Low,True,True,30 minutes,0.1
TICK_10,ORG_1,29/06/2023,"Rep: We tried to make a large payment for software licences, but it was declined for insufficient funds. Though, according to our records, we should have enough. Agent: Let me see... There was a hold placed on your account due to a large incoming wire transfer that hasn't cleared yet. Rep: Can you release the hold? We need to make this payment today. Agent: I'll do my best, but it depends. Let me see.",Payment Processing Issue,High,True,False,Not resolved,-0.6
TICK_11,ORG_1,07/07/2023,"Rep: I'm calling to inquire about options for short-term financing to cover a temporary cash flow gap. Agent: We offer various short-term loan products and lines of credit. Can you tell me more about your specific needs, including the amount and repayment timeline? Rep: Approximately $200,000, repayment within 90 days.",Loan Inquiry,Medium,False,True,2 days,0.5
TICK_12,ORG_1,12/07/2024,"Agent: Hello, Innovate Solutions, how can I help?. Rep: I have not been able to reach any of our contacts in the bank for several days, calls are going to voicemail, emails are not being responded. I need to speak to someone about escalating a previous support issue urgently. Agent: Apologizes, I will escalate this internally. ",Account Management,High,True,False,Not resolved,-0.7
TICK_13,ORG_2,12/08/2023,Good morning.  We're seeing a delay in the posting of an ACH payment sent yesterday for payroll.  Can you confirm its status? The confirmation number is ACH12987.,Payment Processing Issue,High,False,True,2 hours,0.3
TICK_14,ORG_2,25/09/2023,"Hello, I need to update the authorized signers on our business account.  We have had a change in our CFO. Please send me the necessary paperwork.",Account Management,Medium,False,True,1 day,0.7
TICK_15,ORG_2,18/10/2023,I'm calling to inquire about current interest rates on a short-term line of credit. We're considering expanding our services.,Loan Application,Low,False,True,2 days,0.6
TICK_16,ORG_2,03/11/2023,"We noticed an unusual transaction on our account statement.  A debit of $5,000 to 'MedEquip Suppliers' that we don't recognize.",Fraud Alert,Critical,False,True,24 hours,-0.8
TICK_17,ORG_2,17/11/2023,"Hi, I'm having trouble logging into the online banking portal.  I've tried resetting my password, but I'm still getting an error.",Technical Support,Medium,False,True,1 hour,-0.2
TICK_18,ORG_2,01/12/2023,Good afternoon. We need to order new checkbooks for our operating account.,Account Management,Low,False,True,3 days,0.5
TICK_19,ORG_2,15/12/2023,"I'm calling to dispute an ACH transaction that was processed incorrectly. The amount was for $1,200, should have been $1,000. Our vendor ref is 'Supplies4U'.",Payment Processing Issue,High,False,True,3 days,-0.5
TICK_20,ORG_2,28/12/2023,I'd like information on setting up wire transfers for international payments.  We're starting to source supplies from overseas.,Account Management,Medium,False,True,1 day,0.7
TICK_21,ORG_2,09/01/2024,Our online banking access is very slow. It's taking several minutes to load each page. This is impacting our ability to reconcile accounts.,Technical Support,Medium,True,False,Not resolved,-0.6
TICK_22,ORG_2,23/01/2024,We received a notice about a potential security breach. Can you confirm if our account was affected?,Fraud Alert,Critical,False,True,4 hours,-0.7
TICK_23,ORG_2,06/02/2024,I need to increase our daily ACH transfer limit. We have a large payment due to a supplier next week.,Account Management,High,False,True,1 day,0.4
TICK_24,ORG_2,20/02/2024,I'm calling to get a copy of our account statements for the past six months. We need them for our annual audit.,Account Management,Low,False,True,1 day,0.5
TICK_25,ORG_2,05/03/2024,We're having trouble reconciling our account. There's a discrepancy of $250 that we can't account for.,Payment Processing Issue,Medium,False,True,2 days,-0.3
TICK_26,ORG_2,19/03/2024,"Good morning. We made a payment to a vendor two days ago through online banking, but they claim not to have received it. Can you please trace it back to check what happened? The amount was $4,500.",Payment Processing Issue,High,False,True,1 day,0.2
TICK_27,ORG_2,02/04/2024,I need to update our business address on file. We recently relocated our administrative offices.,Account Management,Medium,False,True,2 days,0.6
TICK_28,ORG_2,16/04/2024,"We are experiencing difficulties in downloading bank statements in CSV format, we get an error message 'Format not valid'. It was working fine last month.",Technical Support,Medium,False,True,4 hours,0.1
TICK_29,ORG_2,30/04/2024,Is there a way to automatically sweep excess funds from our operating account into a higher-yield savings account?,Account Management,Low,False,True,3 days,0.7
TICK_30,ORG_2,14/05/2024,"The check images on our online account are not appearing, there is not error message, just the place holders.  Can you please look into this?",Technical Support,Medium,False,True,2 hours,0
TICK_31,ORG_2,28/05/2024,"I need to speak to someone regarding fees being charged on our account. We were told certain fees would be waived, but we are still seeing them on our statement.",Account Management,Medium,True,False,Not resolved,-0.7
TICK_32,ORG_2,11/06/2024,We're considering refinancing our existing loan.  What are the current rates and terms available?,Loan Application,Low,False,True,4 days,0.5
TICK_33,ORG_2,25/06/2024,"We have a payroll ACH file to upload, and for some reason, the page in Online Banking is not loading correctly, just shows a blank page.",Technical Support,High,False,True,3 hours,-0.2
TICK_34,ORG_2,09/07/2024,"Hello, I need to change the scheduled date of an automatic payment of a utility bill, from the 15th to the 20th of each month.",Payment Processing Issue,Medium,False,True,1 day,0.6
TICK_35,ORG_2,23/07/2024,"I'm trying to change the email address for our monthly statements and alerts, but the field is not editable.",Technical Support,Low,False,True,2 hours,0.3
TICK_36,ORG_2,06/08/2024,"We received an email warning that our online credentials might have been compromised, but we are not sure if it comes from the bank, it has several grammar mistakes.",Fraud Alert,Critical,False,True,4 hours,-0.85
TICK_37,ORG_2,07/08/2024,"Two ACH payments from last week, amounting 5500 each one, have yet to clear in our balance.",Payment Processing Issue,High,False,False,Not resolved,-0.7
TICK_38,ORG_3,12/01/2024,"Agent: Good morning, Global Trade Manufacturing. John speaking.  Representative: Hi John, this is Sarah from accounting. We're trying to reconcile our recent wire transfer to a supplier in China, but the confirmation hasn't come through. Can you check the status? Agent: Certainly, I can help with that. Can I have the transaction ID or date and amount? Representative: Yes, the transaction ID is WX12345678. Agent: One moment... Okay, it seems to be processing. There might be some delays due to international processing times. I'll escalate this and get back to you within the hour.",Payment Processing Issue,Medium,False,True,2 hours,0.2
TICK_39,ORG_3,15/01/2024,"Agent: Global Trade Manufacturing support, how can I help? Representative: This is Michael from finance. I'm calling about our existing line of credit. We're looking to potentially increase it to support a new machinery purchase. Agent: I understand. I can connect you with our commercial lending department. They can discuss your options and requirements. Representative: That would be excellent. Thank you.",Loan Application,Medium,False,True,1 hour,0.7
TICK_40,ORG_3,22/01/2024,"Agent: Hello. Representative: Hi, this is Emily from Global Trade Manufacturing. We have a new Head of Finance starting next week and we need to update the authorized signatories on our accounts. Can you guide me on the process? Agent. Yes, you will need to submit a formal request with an authorized signatory's signature, along with the new hire's identification and onboarding documents. I can email you the required forms and further instructions, what's your email?. Representative: It's emily.finance@gtm.com Agent: Received, will get this to you shortly. Representative: Great, thanks.",Account Management,Medium,False,True,24 hours,0.6
TICK_41,ORG_3,05/02/2024,"Agent: Thank you for calling. Representative: Hi, this is David from Global Trade. We received an email about potential fraudulent activity on one of our corporate cards. Agent: I'm very sorry to hear that. Let me connect you immediately to our fraud department. Please hold. Representative: Thank you.",Fraud Alert,High,False,True,6 hours,-0.5
TICK_42,ORG_3,19/02/2024,"Agent: Global Trade Support. Representative: Hello, this is Lisa. I'm having trouble accessing the online banking portal. It keeps saying my password is incorrect, but I'm sure I'm entering it correctly.  Agent: Okay, I can assist you with resetting your password. For security, can I verify your user ID and date of birth associated with the account? Representative: Sure, my ID is ... and date or birth is ... ",Technical Support,Medium,False,True,30 minutes,0.1
TICK_43,ORG_3,01/03/2024,"Agent: Good morning. Representative: Good morning, this is Robert from Global Trade Manufacturing. We're experiencing issues with a batch payment file upload today. It's giving us an error message. Agent: Can you please provide the error message and the file name? Representative: The error message is 'Invalid File Format' and the file name is 'Payroll_03012024'. Agent: We have identified this as a known issue and the fix is being implemented. Representative: I see.",Payment Processing Issue,High,True,True,4 hours,-0.2
TICK_44,ORG_3,10/03/2024,"Agent: Hello, how can I assist you? Representative: This is Susan from Global Trade's accounts payable.  We made a duplicate payment to one of our vendors. Transaction ID is XYZ98765432. Can you help us reverse one of them? Agent: Let me look into that for you.  Can I confirm the vendor's name and the amount of both transactions? Representative: The vendor is Sterling Steel, ...",Payment Processing Issue,High,False,True,2 days,-0.3
TICK_45,ORG_3,22/03/2024,"Agent: Corporate Banking Support. Representative: Hi, This is Tom from Global Trade. I need to order some new checkbooks for our operating account. Agent: Certainly. I can place that order for you. Can I confirm the account number and the quantity of checkbooks you require? Representative: Yes, the account number is... and we need five checkbooks.",Account Management,Low,False,True,1 hour,0.5
TICK_46,ORG_3,08/04/2024,"Agent: Thank you for calling. Representative: Hi, this is Jennifer from Global Trade Manufacturing. I'm calling to inquire about the current interest rates on your commercial loans. We're exploring financing options for a new project. Agent: I can connect you with a loan specialist who can provide you with detailed information and answer your questions. Representative: That would be perfect.",Loan Application,Medium,False,True,30 minutes,0.6
TICK_47,ORG_3,18/04/2024,"Agent: Good afternoon. Representative: Afternoon, this is Alex from Global Trade. We're not receiving our monthly account statements by mail anymore.  Agent: I apologize for the inconvenience. Let me check the mailing address we have on file. Can you confirm your current mailing address? Representative: Yes, it's 123 Main Street, Anytown, Ohio, 44123.",Account Management,Low,True,True,1 day,0.3
TICK_48,ORG_3,29/04/2024,Agent: Global Trade Support. Representative: This is Mark from IT. We're implementing a new accounting software and need information about your bank's API capabilities for transaction downloads. Agent: I can direct you to our technical support team specializing in API integrations. They can provide you with the necessary documentation and support. Representative: Thank you.,Technical Support,Medium,False,True,1 hour,0.4
TICK_49,ORG_3,04/05/2024,"Agent: Banking support Representative: Good day I am John from Global and the monthly PDF statement provided is returning a 'corrupt file' error. This is needed urgently. Agent: My apologies. What is your account number and when did you try and open the file? Representative: Account is ***********, I tried an hour go, when I received it. Agent: The issue is the file generator. Files are being regenerated now.",Technical Support,High,True,True,2 hours,-0.5
TICK_50,ORG_3,06/05/2024,"Agent: Corporate Banking Support. Representative: Hi, my name is Alice, and our CFO requires multi-factor authentication for all online access. How do we set this up currently? Agent: Okay, I can walk you through the setup, firstly let's login to your settings online and... ",Account Management,Medium,False,True,1 Hour,0.7
TICK_51,ORG_3,10/05/2024,"Agent: Good morning. Representative: Hi, This is Mary from Global Trade. I want to schedule a call to go through new features I heard being rolled out to your online banking. Agent. Certainly, let me check our system. What time would be best for you?. Representative: Any time next week would be great. On May 13 particularly. Agent: I'll put you in with our representative, Chris",General Inquiry,Low,False,True,5 minutes,0.7
TICK_52,ORG_3,15/05/2024,"Agent: Hello, Global Banking Support speaking. Representative: Good day, I'm calling from Global Trade. I would like to know which of our employees initiated a large international wire transfer last week. Agent: For security reasons, I cannot provide that via phone. Please submit a request in writing via secure electronic transfer. Representative: Understood.",Account Management,Medium,False,True,4 hours,0.3
TICK_53,ORG_3,16/06/2024,"Agent: Corporate Support. Representative: This is Peter from Global Trade. We are disputing a transaction on our latest statement. Agent: I can help with. Can you provide the Transaction ID, amount, and name of merchant? Representative: Yes, the transaction ID is... the amount is... ",Payment Processing Issue,Medium,False,False,Not Resolved,-0.5
TICK_54,ORG_3,20/06/2024,"Agent: This is the corporate banking helpline. Representative: This is Zhang Wei, new head of finance. Could you explain our current overdraft arrangements? Agent: Certainly, I can go over that with you. Can I take your details to access your account please? Representative: Yes, my details are... ",General Inquiry,Medium,False,True,1 hour,0.6
TICK_55,ORG_3,23/06/2024,"Agent: Global Trade account management. Representative: Agent: Can you confirm your username and other details for security purposes? Representative: My username is 'example', my staff id is 12345. The banking page seems to be down. Agent: We are experiencing some issues with online systems. I'm afraid the system needs rebooting.",Technical Support,Critical,True,True,30 minutes,-0.8
TICK_56,ORG_3,03/07/2024,"Agent: Account support. Representative: Hi, this is Michelle Lee; our payment run on the first of the month failed. Agent: We are getting a lot of calls about that, as we've updated our system, and it is causing issues. Representative: Okay do not process any until I confirm with you. This is important. Agent: Understood.",Payment Processing Issue,Critical,True,True,6 hours,-0.9
TICK_57,ORG_3,15/07/2024,"Agent: Hello, how can I help? Representative: Hi there. Two-factor authentication is failing. Agent: Okay can you unlock the 2fa via your secondary security measure? Representative: I have done, but I can't access the account system still. Agent: This may be related to some system issues. I'll forward you to Technical Support.",Technical Support,High,True,True,3 hours,-0.7
TICK_58,ORG_3,29/07/2024,"Agent: Thank you for calling. Representative: Can you confirm the exchange rates used for a recent international payment? Agent: Please give me the transaction number and date and I will track that for you. Representative: Sure, the number is...",General Inquiry,Low,False,True,30 minutes,0.5
TICK_59,ORG_3,01/08/2024,"Agent: Corporate help desk. Representative: I'm having problems sending multiple, separate wire payments. Is there an easier way to pay vendors. Agent: Yes. We can set you up with Bulk Payments. Would you like to set this up? Representative: Yes please.",Account Management,Medium,False,True,24 hours,0.7
TICK_60,ORG_3,03/08/2024,"Agent: Thank you for calling. Representative: Hello, this is the procurement department, we need to raise our daily credit card limits. Agent: I'll forward you to the cards department, please hold. Representative: Thank you.",Account Management,Medium,False,True,1 hour,0.4
TICK_61,ORG_3,10/08/2024,"Agent: Global Trade Banking support. Representative: Hi, can I get a copy of my contract for the loan taken on 'so and so date'? Agent: I can do that. Representative: What's your email? I'll send you our details. Agent: You can submit supporting details to documents@bank.com.",Loan Application,Low,False,True,30 minutes,0.6
TICK_62,ORG_3,02/09/2024,"Agent: Banking Support, how can I assist? Representative: Good day, I'd like to set up regular reports of failed payments. Agent: Yes, we can absolutely set up custom reporting schedules. Let me take your information. Representative: Excellent.",Account Management,Medium,False,True,2 Days,0.7
TICK_63,ORG_3,07/09/2024,"Agent: Good morning. Representative: We have recently updated our tax information, how do we officially file with you? Agent: Best way to do that is via the secure portal. Do you have access? Representative: I don't, can this be reset for me: Agent: I can help. Can I verify your user ID?",Account Management,Medium,True,True,30 minutes,0.5
TICK_64,ORG_3,29/09/2024,"Agent: Good day. Representative: Can payments over 1 million require two signatories? Agent: We can implement that. Let me verify your account. Representative: Sure, account details are...",Account Management,Medium,False,True,24 Hours,0.8
TICK_65,ORG_3,03/10/2024,Agent: How can I help? Representative: We require a letter confirming our banking relationship for the last six months. Agent: I can send this via mail or secure download? Representative: Secure download works. Agent: That will come through soon.,General Inquiry,Low,False,True,1 Hour,0.6
TICK_66,ORG_3,08/10/2024,"Agent: Corporate Account line. Representative: Can I generate transaction reports for specific periods via your API? Agent: yes, can you send an email requesting API support to our Tech team? Representative: What's the address? Agent: techsupport@bankemail.com",Technical Support,Medium,False,True,3 days,0.3
TICK_67,ORG_3,12/10/2024,"Agent: Good Morning. Representative: Morning. There is a transaction pending which shouldn't be authorized. Agent: Can I have your account number and transaction number? Representative: Certainly, it's 1234. Agent: I've put a hold on that transaction. We'll investigate.",Payment Processing Issue,High,False,True,3 hours,-0.6
TICK_68,ORG_3,03/11/2024,Agent:Thank you for calling. Representative: I cannot attach supporting documents for a large transaction? Agent: What is the file size? Representative: Greater than 5MB. Agent: Please utilise our file transfer service. The link can be found on your online account home page.,Technical Support,Medium,True,True,5 minutes,0.1
TICK_69,ORG_3,11/11/2024,Agent: Good Day. Representative: We need to understand charges on our latest statement. Agent: which transactions? Please give details. Representative: The ones marked international transfer.,General Inquiry,Low,False,True,20 minutes,0.4
TICK_70,ORG_3,15/11/2024,"Agent: Corporate support. Representative: We would like to query the requirements for opening a subsidiary banking account in Singapore. Agent: We have a dedicated team for international business setups, I'll forward you. Representative: Thank you.",General Inquiry,Medium,False,True,15 Mins,0.8
TICK_71,ORG_3,20/11/2024,"Agent: How can I direct your call? Representative: Our payment processing software vendor recommends switching our payments to SWIFT Transfers, Can you do that?Agent: Yes, we can implement that change once you fill the forms I'll send you. Representative: Great, thanks.",Payment Processing Issue,Medium,False,True,48 Hours,0.7
TICK_72,ORG_3,05/12/2024,"Agent: Support Line. Representative: I need access to archived statements for the last 7 years. Agent: We can facilitate this, though there may be a small charge for older documents. Representative: That's fine.",Account Management,Low,False,True,4 days,0.3
TICK_73,ORG_3,12/12/2024,"Agent: Thank you for calling. Representative: I'd Like to inquire about better interest rates on our deposit account. Agent: Can you explain your current and projected balances? Representative: Yes, the average balance is around $3,000,000. We anticipate this to possibly increase",General Inquiry,Medium,False,False,Not resolved,0.5
TICK_74,ORG_3,14/12/2024,"Agent: How may I help you today? Representative: Good morning, I'm calling from Global Trade Manufacturing, my name is Fred Smithers. I'd like to speak with someone regarding a letter of credit for a transaction with a new German supplier. Agent: I will pass you to the correct department, hold please.",General Inquiry,Medium,False,True,10 minutes,0.7
TICK_75,ORG_3,16/12/2024,"Agent: Good day, corporate support. Representative: Hi, I need to understand how your system integrates with SAP. Agent: We have documentation we can share. Can I have your email to forward this to you? Representative: Yes, my email is...",Technical Support,Medium,False,True,1 hour,0.6
TICK_76,ORG_4,12/08/2023,Good morning. I'm calling from Fresh Foods Market.  We have a question regarding the interest rate on our recent loan.  We were expecting a different rate per our term sheet. Can you please clarify?,Loan Application,Medium,False,True,24 hours,0.2
TICK_77,ORG_4,15/09/2023,"Hello, This is John from Fresh Foods Market. Our online banking portal is showing a pending transaction from yesterday that we don't recognize.  Could this be a security breach? It's a high amount.",Fraud Alert,High,False,True,4 hours,-0.6
TICK_78,ORG_4,22/09/2023,"Hi, we're experiencing a slower than usual processing time for credit card payments today. Customers are complaining. Affecting multiple stores. Can you investigate?",Payment Processing Issue,High,False,True,2 hours,-0.4
TICK_79,ORG_4,02/10/2023,I'm calling to follow up on a wire transfer we initiated last Friday.  It hasn't hit the recipient's account yet.  The reference number is WFT12345. It is for a vendor 'Produce Suppliers Inc.',Payment Processing Issue,Medium,False,True,8 hours,0.1
